{
  "$schema": "https://schemas.luh.tech/decision-log.schema.v2.json",
  "version": "1.0.0",
  "ventureId": "VENTURE_ID",
  "lastUpdated": "2025-12-11T00:00:00Z",
  "decisions": [],
  "indexes": {
    "byStatus": {
      "proposed": [],
      "approved": [],
      "implemented": [],
      "superseded": [],
      "rejected": [],
      "deferred": []
    },
    "byCategory": {},
    "byImpact": {
      "critical": [],
      "high": [],
      "medium": [],
      "low": []
    },
    "byQuarter": {}
  },
  "governance": {
    "requiredApprovers": 1,
    "approverRoles": [
      "founder",
      "tech-lead"
    ],
    "autoApproveCategories": [],
    "reviewIntervalDays": 180,
    "escalationPath": [
      "erik-luhtech"
    ],
    "notificationChannels": []
  },
  "stats": {
    "total": 0,
    "proposed": 0,
    "approved": 0,
    "implemented": 0,
    "superseded": 0,
    "rejected": 0
  }
}
